{
  "name": "Test Application",
  "type": "flogo:app",
  "version": "0.0.1",
  "description": "",
  "triggers": [
    {
      "name": "Receive HTTP Message",
      "ref": "github.com/TIBCOSoftware/flogo-contrib/trigger/rest",
      "description": "Simple REST Trigger",
      "settings": {
        "port": null
      },
      "id": "receive_http_message",
      "handlers": [
        {
          "settings": {
            "method": null,
            "path": null,
            "autoIdReply": null,
            "useReplyHandler": null
          },
          "actionId": "test_flow",
          "actionMappings": {
            "input": [],
            "output": []
          }
        }
      ]
    }
  ],
  "resources": [
    {
      "description": "ddadfads",
      "data": {
        "flow": {
          "name": "Test Flow",
          "type": 1,
          "attributes": [],
          "rootTask": {
            "id": "root",
            "type": 1,
            "tasks": [
              {
                "id": "log_2",
                "name": "Log Message",
                "description": "Simple Log Activity",
                "type": 1,
                "activityType": "tibco-log",
                "activityRef": "github.com/TIBCOSoftware/flogo-contrib/activity/log",
                "attributes": [
                  {
                    "name": "message",
                    "value": "Hello world",
                    "required": false,
                    "type": "string"
                  },
                  {
                    "name": "flowInfo",
                    "value": "true",
                    "required": false,
                    "type": "boolean"
                  },
                  {
                    "name": "addToFlow",
                    "value": "true",
                    "required": false,
                    "type": "boolean"
                  }
                ]
              }
            ],
            "links": [],
            "attributes": []
          }
        }
      },
      "id": "test_flow",
      "metadata": {
        "input": [
          {
            "name": "one",
            "type": "string"
          }
        ],
        "output": [
          {
            "name": "two",
            "type": "string"
          }
        ]
      },
      "ref": "github.com/TIBCOSoftware/flogo-contrib/action/flow"
    }
  ]
}
